id,title,description,url
5123,tennessee's long-range transportation plan,"facing a coming budget deficit, the tennessee department of transportation pursued multi-method communication and strategy development between the public, stakeholders, and officials. the resulting plan covers 8 policy areas and takes local- and regional-level needs into account.",https://participedia.net/case/5123
5124,"coffee cup revolution (vancouver, canada)","the annual coffee cup revolution is community-led and run by low-income residents. the event includes a pop-up recycling depot, roundtable discussions, and awareness raising around issues of sustainable living, green waste disposal, and economic inclusion.",https://participedia.net/case/5124
5125,tides of change: cormorant island economic development plan,"an inclusive, comprehensive economic development plan written for residents, by residents through a year-long series of public consultations and community engagements. the resulting plan effectively synthesized community visions into short- and long-term policies and strategies. ",https://participedia.net/case/5125
5126,águeda participatory budget (portugal),a participatory budgeting initiative implemented following other citizen engagement projects both in the city of agueda and in other cities across the country. the scheme was introduced in 2015 and has been running ever since. participation is both in-person and online. ,https://participedia.net/case/5126
5127,public participation in the anthemountas river basin management plan,"a project of public participation in water governance in greece, on managing the anthemountas river basin, under the wfd provisions and the funding of eu life programme. ",https://participedia.net/case/5127
5128,public hearings on the termination of anencephalic fetuses ,"before legislating on the issue, public hearings were held to allow citizens and stakeholders to testify and present information on the termination of anencephalic fetuses. it is unclear if the hearings had any effect on policy making. ",https://participedia.net/case/5128
5129,2013 federal supreme court public hearings on campaign financing (brazil),"public hearings convened by the supreme court to determine the constitutionality of electoral donations per legal person, the limit imposed on said donations, and use of donations during campaigning. the results had little obvious influence on the final vote in the legislature.",https://participedia.net/case/5129
5131,first national conference on public security (brazil),"2009 saw the first of an ongoing series of national conferences on public security policy and management. the participatory forum allowed for citizens, civil society organizations, and private professionals to interact and collectively inform public security policy. ",https://participedia.net/case/5131
5132,"regional forums of the elderly, northwest belo horizonte (brazil)","regional forums are held for members of municipal councils for the elderly to discuss and debate issues of aging and social assistance with civil society representatives, elected officials, and service providers. the forums allow information and opinion sharing but little else.",https://participedia.net/case/5132
5133,"dahlia campus for health & well-being (denver, colorado)","a citizen engagement initiative, ‘the dahlia project’ included in-depth public consultations on the development of a new mental health centre after local residents protested against the construction. the center continues to pursue local partnerships and capacity building. ",https://participedia.net/case/5133
5147,energy transition north rhine-westphalia (2015-2017),a research initiative to plan and implement various participatory processes to direct north rhine-westphalia's transition to clean energy. ,https://participedia.net/case/5147
5151,"the democracy project: youth participation and democratic education (burnaby, british columbia)",a youth-led project which allowed a group of high school students to become more democratically involved in the regional school board. the project changed the way high-level school decision are made by including student representatives in the process. ,https://participedia.net/case/5151
5152,enertransruhr: cultural mapping of the ruhr region energy transition,"the enertransruhr project analyses and develops strategies for germany's transition to clean energy with a focus on increasing energy efficient buildings in ruhr region cities like bottrop, dortmund, and oberhausen.",https://participedia.net/case/5152
5161,zapatista school,"the escuelita zapatista is a path of education from below in which thousands of people from all over the world have been able to share, together with the indigenous zapatistas, forms of participation aimed at the collective exercise of the principles of autonomy and democracy.",https://participedia.net/case/5161
5164,"ict facilitation of citizen participation, open government, and public service delivery in madrid","an initiative to make madrid a 'smart city': one where citizens are digitally connected with each other, with elected officials, and with public services through various ict platforms and devices. goals include increased democratic participation and government responsiveness. ",https://participedia.net/case/5164
5166,citizens' assembly on brexit,"in 2017, a two-weekend citizens' assembly on post-brexit eu relations was attended by a representative sample of uk citizens. the deliberations provided invaluable insight into public opinion on the issue for use by researchers and policy makers.  ",https://participedia.net/case/5166
5168,british columbia electoral reform process (2002-2005),"attempts to reform the canadian province of british columbia's electoral system involved educational outreach, a citizen's assembly to determine the best alternative to the current first-past-the-post system, and public hearings, culminating in a popular referendum. ",https://participedia.net/case/5168
5169,british columbia referendum on electoral reform (2005),"on may 17, 2005, a referendum was held in british columbia on whether the recommendation of the citizens' assembly on electoral reform to replace the first-past-the-post electoral system with single transferable vote should be adopted. it failed to achieve the supermajority required.",https://participedia.net/case/5169
5172,climate initiative essen: building an active climate culture,"winner of the german ministry for education and research ""energy-efficient city"" competition, the initiative promotes environmental conservation in essen through bottom-up, participatory action by private companies and civil society groups.",https://participedia.net/case/5172
5174,valle d'aosta water protection plan [italian],,https://participedia.net/case/5174
5176,"engaging youth in municipal youth policy development (santa, northwest cameroon)","between 2010 and 2015, youth leaders were engaged in a process to develop a municipal youth policy in santa, northwest cameroon, as a means to promote greater youth voice and participation in municipal governance and decision making.",https://participedia.net/case/5176
5182,africa i-parliaments action plan,africa i-parliaments is a set of united nations initiatives and projects designed to enable african parliaments to facilitate democracy and good governance through technology applications.,https://participedia.net/case/5182
5186,participatory budget 2016 - municipality of rivalta di torino [italian],"fourth 2016-2017 edition of the participatory budget of rivalta di torino (20,000 inhabitants). the initiative was initiated by the rivalta sostenibile civic list in 2013 but in the elections of june 2017 the list was replaced by the coalition of the democratic party.",https://participedia.net/case/5186
5187,seeking the meaningful inclusion of people with disabilities: hearts & hands’ path process in l’arche antigonish (nova scotia),people with and without intellectual disabilities used the “planning alternative tomorrows with hope” technique to rethink the hearts & hands community arts program and to increase the engagement of people living with disabilities in community decisions.,https://participedia.net/case/5187
5189,palmaria nel cuore [italian],,https://participedia.net/case/5189
5190,kenya youth manifesto,"kenyan youth have been largely excluded from meaningful political participation in the past so, leading up to the 2017 general elections, a manifesto was collaboratively written to outline the views of the nation's youth and demand the establishment of a national youth policy.",https://participedia.net/case/5190
5192,switch. reuse of abandoned spaces. new ideas to change perspective [switch. reusing abandoned places. new ideas to change perspectives],,https://participedia.net/case/5192
5194,something new on the western front - social cohesion in west pavia],,https://participedia.net/case/5194
5196,the women’s advisory platform: promoting gender-inclusive governance in juaboso district (ghana),"in 2013, netright facilitated the creation of the women’s advocacy platform by training and supporting women in the juaboso district to lead advocacy for greater representation and gender responsiveness in local and district-level governance and development planning.",https://participedia.net/case/5196
5197,house of commons and citizenship workshops],,https://participedia.net/case/5197
5199,participatory planning germany's nuclear waste disposal strategy,"facing the need for a suitable location for its nuclear waste disposal, germany undertook a process of open public discourse, critique, and participation. by using a participatory democratic approach, stakeholders hoped to legitimize the final decision and preempt disagreement. ",https://participedia.net/case/5199
5200,"people's initiative on direct democracy, participation and political education in bolzano [citizens' initiative for a law on direct democracy, participation and political education in bolzano]",,https://participedia.net/case/5200
5204,forum of common goods and solidarity economy of friuli venezia giulia [fvg commons and inclusive economy forum],,https://participedia.net/case/5204
5206,circularicity: civic crowdfunding for the circular economy,circularicity is a participatory process initiated by the municipality of capannori to involve citizen and stakeholder collaboration in respect of the circular economy and sustainability. five selected projects were partially financed through crowdfunding.,https://participedia.net/case/5206
5209,european awareness scenario workshop initiative,the european awareness scenario workshop was a european commission initiative used to examine innovative projects in the european context.,https://participedia.net/case/5209
5211,european local democracy week,the european local democracy week is an annual event held in eu member countries to foster civic and political engagement by promoting the knowledge of local democracy and the idea of democratic participation at a local level. ,https://participedia.net/case/5211
5212,security and development for fontivegge and bellocchio areas in perugia [security and development for fontivegge and bellocchio areas in perugia],,https://participedia.net/case/5212
5213,habitat conservation planning in the u.s.,"section 10 of the endangered species act allows for the creation of partnerships between public and private sectors and among government agencies to balance the need for environmental conservation with the need for construction, development, and other land use. ",https://participedia.net/case/5213
5215,ethiopian qero management of the gaussa-menz grasslands,"a collaborative, participatory form of environmental sustainability and conservation based on an indigenous system of governance. the system's use allows for a decolonization of the regulation and management of the traditional lands of local, indigenous residents. ",https://participedia.net/case/5215
5217,sustainable urban mobility plan of perugia [sustainable urban mobility plan of perugia city council],,https://participedia.net/case/5217
5219,participatory budgeting of ceprano council],,https://participedia.net/case/5219
5222,pacc abruzzo - climate change adaptation plan of abruzzo region [climate change adaptation plan of abruzzo region],,https://participedia.net/case/5222
5225,public participation on migration policy in the puglia (apulia) region,"the participatory process ""migrazione condivisa e sostenibile (mics)"" (translated: shared and sustainable migration) engaged input from citizens, associations, trade unions, and stakeholders in the immigration sector, for drafting the region's 2016-2019 migration policy plan.",https://participedia.net/case/5225
5228,people's policy on childrens' wellbeing,a collaborative approach to policy making around the issue of child welfare and the foster system. this was the first use of the people's policy method which attends to build legislation from the bottom-up: from citizen to government.,https://participedia.net/case/5228
5231,ventaglieri social park. participation changes naples [ventaglieri social park. public participation changes naples],,https://participedia.net/case/5231
5232,women's mediation training great lakes & horn of africa region ,,https://participedia.net/case/5232
5234,particip @ ctivi. the confrontation that multiplies ideas. palermo [active-participation. debate multiplies ideas],,https://participedia.net/case/5234
5236,municipal urban plan of olbia [olbia local plan],"a participation process to support the stages of elaboration of the municipal urban plan, aware of the need for an important communication investment and mobilization of the local community, in order to adequately share and legitimize the plan.",https://participedia.net/case/5236
5239,"community justice boards in pima county, arizona","cjb volunteers work with the pima county attorney's office. the program uses restorative justice techniques as an alternative to prosecution for 1st and 2nd-time, non-violent, juvenile offenders, bridging the gap between victims and offenders, and focusing on rehabilitation. ",https://participedia.net/case/5239
5241,re-designing el nudillo intersection - san diego,"the concept of el nudillo was created during two workshops held in 2017 in east village san diego last year. el nudillo—spanish for ""joint"" or ""knuckle""—is where 14th street ends at the trolley tracks on commercial street, just at the intersection of national avenue.",https://participedia.net/case/5241
5242,pb squared: organizational participatory budgeting,"each year, the participatory budgeting project allows all of their donors to allocate a portion of their donations using participatory budgeting.",https://participedia.net/case/5242
5246,community-university rain gardens on vancouver’s north shore,citizens and university students are collaborating to design and build demonstration rain gardens to engage the public in learning the ecological and aesthetic value of this kind of green infrastructure. ,https://participedia.net/case/5246
5248,"gender-responsive participatory budgeting in wenling, china",efforts were made by the wenling municipal government for transparency and women's participation in the budgeting process.,https://participedia.net/case/5248
5281,los angeles metro purple line extension,"a  comprehensive public engagement strategy starting in 2008, consisting of townhalls, online discussion boards, and a media campaign in order to make the purple line expansion process more inclusive and transparent.",https://participedia.net/case/5281
5282,informed citizen akron: ohio citizens' jury on issue-based media coverage in the 2016 presidential election,this initiative in ohio uses citizens juries and poll data to better adapt the media coverage of presidential elections to cover the issues most important to citizens.,https://participedia.net/case/5282
5283,"san casciano val di pesa community mobility network, italy","in san casciano val di pesa, italy, local residents and community organizations co-designed a more inclusive public transportation network.",https://participedia.net/case/5283
5284,landlord guarantee pilot program boston,"a mayoral initiative which aims to provide permanent housing to homeless individuals and families by providing them with financial support and incentivizing landlords through offering a guaranteed fund of up to $10,000 in the event that any losses are incurred.",https://participedia.net/case/5284
5285,"gender responsive and participatory budgeting in penang, malaysia","through local councils and nonprofits, organizers developed an inclusive, gender-responsive participatory budgeting project that led to concrete changes in two local housing projects. ",https://participedia.net/case/5285
5287,foodborne chicago,"chicago uses social media, twitter in particular, to track and share information on food-borne illnesses.",https://participedia.net/case/5287
5290,"lower main regional water forum in bavaria, germany","the lower main regional water forum is a process of stakeholder participation concerning policies for managing the lower main river sub-basin in bavaria, germany. begun in 2005 and organized by the bavarian environment agency, the forum consists of one, 3-hour meeting each year.",https://participedia.net/case/5290
5293,the vancouver bubble,"the vancouver bubble is an inflatable pop-up installation produced by the vancouver design nerds to transform public spaces into ""citizen spaces"" by acting as a platform for community engaged programming and dialogue.",https://participedia.net/case/5293
5299,"2016 collective intelligence for democracy workshop (medialab-prado's participalab, madrid)",an annual event that invites multidisciplinary teams to create digital prototypes for the facilitation of collective intelligence and public participation. the 2016 workshop drew participants from 30 countries who collaborated on 8 new technologies. ,https://participedia.net/case/5299
5300,early court jury cases,"in modern democracies, serving on a jury is the most common form of institutionalized public participation outside of voting. due process and trial by a jury of one's peers are both central democratic principles.",https://participedia.net/case/5300
5303,calgary community engagement on school transportation budget,"the calgary board of education, facing limited funding, reduced student transportation services. after community opposition, the cbe and a consultant led a community engagement process to educate the public on the issue and receive input on the community’s budgeting priorities.",https://participedia.net/case/5303
5304,occupy vancouver's use of the spokes council,occupy vancouver's spokes council was developed through a democratic process of five work groups. ,https://participedia.net/case/5304
5313,early cabildos abiertos cases,"cabildo abiertos are central and south american ""open town councils"". this case entry includes examples of its use since the beginning in the 16th century. ",https://participedia.net/case/5313
5316,the irish citizens' assembly,"established in 2016, the citizens' assembly is a permanent, deliberative body of 100 randomly selected citizens who collect public opinion, debate, and provide recommendations on the topics outlined in its founding documents and, later, by members of parliament and the public.",https://participedia.net/case/5316
5317,the 1st sitting of the irish citizens’ assembly: the eighth amendment,the assembly met across five weekends to deliberate the country’s 8th constitutional amendment which defends the right to life. the assembly’s recommendations by majority vote were essentially to repeal or replace the amendment.,https://participedia.net/case/5317
5318,the 2nd sitting of the irish citizens' assembly: responding to an ageing population,"the irish citizens assembly of 2016 examined several key issues facing ireland. held over two weekends, the assembly examined and deliberated how ireland would best deal with the challenges and opportunities presented by ireland’s ageing population.",https://participedia.net/case/5318
5320,better reykjavik: iceland's online participation platform,better reykjavik is an online participatory social network built using the 'your priorities' web application. it allows registered users to post ideas in topic-specific message 'communities' created by the city on topics such as open consultations and participatory budgeting. ,https://participedia.net/case/5320
5321,roundtable on the research & practice of women’s participation & leadership in climate solutions,"a one-day event bringing together a diverse audience of panellists and participants in a roundtable discussion on the state of women's participation in climate change dialogue, governance, and decision-making. ",https://participedia.net/case/5321
5354,hase area co-operation,"the hase area co-operation was a process of stakeholder participation to develop proposals for managing the hase river sub-basin in lower saxony, germany. the process, begun in 2005, was designed by the lower saxony ministry of environment, energy, and climate protection.",https://participedia.net/case/5354
5355,elbe-lübeck working group,"the elbe-lübeck working group was a process of stakeholder participation to develop proposals for managing the elbe-lübeck river sub-basin in schleswig-holstein, germany. the working group process, begun in 2002, was designed by the schleswig-holstein environment agency.",https://participedia.net/case/5355
5356,guadalete and barbate participatory planning process,"the guadalete and barbate participatory planning process was designed to obtain stakeholder feedback on measures for managing the guadalete and barbate river basins in andalusia, spain. the process, held in 2010 and 2014, was organized by the andalusian water agency.",https://participedia.net/case/5356
5357,miera and campiazo basins participatory planning process,"the miera and campiazo basins participatory planning process engaged the public and stakeholders in developing measures for managing the miera and campiazo river basins in cantabria, spain. the process, held from 2008-2011, was organized by the cantabrian environmental agency.",https://participedia.net/case/5357
5358,baix ter basin participatory planning process,"the baix ter basin participatory planning process was designed to engage the public and stakeholders in developing measures for managing the baix ter river basin in catalonia, spain. the process, begun in 2007, was organized by the catalan water agency.",https://participedia.net/case/5358
5359,water management planning in belfast lough and river lagan catchment area (northern ireland),the belfast lough and lagan catchment stakeholder group was designed to engage stakeholders in developing a plan for managing the belfast lough and the river lagan catchment area in the metropolitan areas of belfast and lisburn in northern ireland.,https://participedia.net/case/5359
5371,forth area advisory group,"the forth area advisory group aimed to engage stakeholders in developing a plan for managing the catchment area of the rivers forth and almond in scotland. the process, begun in 2006, was organized by the scottish environmental protection agency’s river basin planning unit.",https://participedia.net/case/5371
5373,2017 congress on iceland's democracy,"a berkeley constitutional center event bringing scholars together to discuss the ten-year process of constitutional reform. organizing as a mock legislative body, participants developed, debated, and decided on concrete action proposals for moving forward. ",https://participedia.net/case/5373
5374,ethiopia's growth and transformation plan ii (2015-2020),"supported by various international agencies, ethiopia's second five-year plan aims to 1) achieve the unsdgs, and 2) double the nation's annual gdp. strategies are wide-ranging but focus on individual and institutional capacity building and good governance. ",https://participedia.net/case/5374
5375,"street law's ""democracy for all""",,https://participedia.net/case/5375
5376,university of the western cape: student learning through community participation,,https://participedia.net/case/5376
5378,european local democracy week 2010,,https://participedia.net/case/5378
5379,digital deliberation (vertically integrated projects),"the vertically integrated projects' digital deliberation involved designing, testing, and implementing of the online large-scale deliberative platform reflect! the project intended to facilitate discussion between people with dissenting opinions and to gamify public deliberation.",https://participedia.net/case/5379
5380,"newton, massachusetts civic engagement study",,https://participedia.net/case/5380
5381,sdgs kenya forum for sustainable development: 'leave no one' behind national dialogues,,https://participedia.net/case/5381
5382,pera natin 'to!: an initiative by the philippines public transparency reporting project,,https://participedia.net/case/5382
5383,vorarlberg citizen council on asylum and refugee policies,"using the unique, homegrown citizens' council method, vorarlberg looked to its citizens in addressing the issue of refugee and asylum integration. the three-phase process gave officials valuable feedback regarding local participation in the resettlement process.",https://participedia.net/case/5383
5384,bioenergy distributed dialogue, a public dialogue meant to inform and guide the biotechnology & biological sciences research council's strategy and policy development. the process trialled a 'distributed' approach to dialogue to allow for continued communication between participants. ,https://participedia.net/case/5384
