id,title,description,url
6189,"participatory budgeting in brno, czech republic","in 2017, brno became the first city in the czech republic to introduce pb municipal level. the initiative gives citizens say over czk 35 million (approx. usd $1.4k) to fund at least 11 projects. pb is just one facet of the ‘smart brno’ initiative to support citizen engagement. ",https://participedia.net/case/6189
6190,"participatory budgeting in san lorenzo, argentina (2012 - present)","pb has been used in san lorenzo since 2013. the introduction of online voting in 2018 increased participation by 50% from previous years, and the 2019-2020 cycle saw the introduction of blockchain technology to increase voting security and funding transparency.",https://participedia.net/case/6190
6191,santalab: santa fe’s public innovation laboratory,"a space for open collaboration using the ‘quadruple helix of innovation’: state, citizenship, organizations, and companies. the project was introduced as part of the state’s policy on innovation and open government, and aims to move from ‘deciding with’ to ‘doing with’ citizens. ",https://participedia.net/case/6191
6192,harvard votes challenge,"a university-wide effort supported to increase voter registration and participation among eligible students, staff and faculty. the civic engagement program is coordinated by students and works across the entire harvard university community.",https://participedia.net/case/6192
6193,red glocal: integrating new immigrants in estacion central ,"launched in january 2019, red glocal facilitates the socioeconomic integration of the city’s newest residents by connecting them to new jobs and helping them open new businesses. the project’s small staff amplifies their impact through collaboration with community partners.",https://participedia.net/case/6193
6194,pop-up retail space for small businesses in jersey city,"looking for an innovative approach to helping small businesses find retail space, jersey city purchased a number of shipping containers to offer business owners a rent-free launch pad for their enterprises while simultaneously create a new pop-up shopping district for the city. ",https://participedia.net/case/6194
6195,"raise-op: creating affordable, inclusive, and democratic homes in lewiston, me","led by young, white college graduates, lewiston’s first housing co-op sought greater representation in its leadership to reach communities in need of housing. raise-op was founded to reflect the diversity of the neighbourhood and to support the civic engagement of its members.",https://participedia.net/case/6195
6196,"re-cast participatory budgeting, st. louis","each year, participatory budgeting delegates have an opportunity to select what services are provided in their community as part of funding from re-cast: the resiliency in communities after stress and trauma $4.7 grant from the substance abuse and mental health administration.",https://participedia.net/case/6196
6197,"participatory budgeting in dartmouth, nova scotia, canada","dartmouth’s pb has been held yearly since 2017, giving district 5 residents the opportunity to cast ballots to award $50,000 in funding to community groups. the initiative was brought to the district by councilor sam austin and was to run again in 2019.",https://participedia.net/case/6197
6198,#bharatkilaxmi social media dialogue on women’s rights ,"a government-led online dialogue on women's rights and equality, the campaign began with a tweet about shila dawre, india’s first woman auto-rickshaw driver. the hashtag has since been trending with people sharing stories of women who have excelled in their fields.",https://participedia.net/case/6198
6199,rewarding citizen recycling with cryptocurrency in argentina,misiones’ local government rewards citizens who separate their waste with ‘jellycoins’. the program incentivizes citizen action on recycling and the use of blockchain technology ensures transparency. citizens have complete control of their earned funds.,https://participedia.net/case/6199
6200,"designing 'unknown soldier square' with pubic space users in gorzów wielkopolski, poland",in 2016 users of the square of the unknown soldier were included in the design stage of changes in public space. the investment organizer was the city hall of gorzów as the first in poland. the company pronobis studio was responsible for the project and cooperation with residents,https://participedia.net/case/6200
6203,"coffee with a cop, evanston ","since 2014, the northwestern university neighborhood and community relations department has hosted a weekly “coffee with a cop” event to provide a “casual space” for residents to talk with officers, ask questions, share concerns, or simply get to know one another.",https://participedia.net/case/6203
6204,"participatory budgeting in greensboro, nc","participatory budgeting was adopted by the city in 2014 at the behest of citizens. each pb cycle lasts two years. citizen ideas are reviewed by volunteers and turned into project proposals which are then held to a public vote. each district is allocated $100,000.",https://participedia.net/case/6204
6205,agriculture tomorrow [italian],"in view of the upcoming programming of european agricultural policies (2021-2027), the council of the province of trento asks how tomorrow's agriculture will be and how do you want it to be, what scenarios you want and what policies to achieve them?",https://participedia.net/case/6205
6207,"city for all program, israel","the city for all program promotes gender mainstreaming and gender equality action plans within local governments in israel. implemented in rishon lezion, taybe, akko and haifa, the program works to create a multi-level gender equality action plan through public participation.",https://participedia.net/case/6207
6208,new york city charter revision process 2018-19,"as part of its work, the charter commission initiated a robust program of civic engagement. two rounds of public hearings were held in each borough, citizens were engaged over social media, and a multi-lingual tele-town hall included simultaneous translation.",https://participedia.net/case/6208
6209,"desa digital, west java","led by the west java ict agency, the project aimed to close the rural-urban digital divide in indonesia by using iot technology, 600 satellites, and a series of digital literacy programmes to help villagers improve their industries.",https://participedia.net/case/6209
6211,"making open data open to all in buffalo, ny","the city of buffalo has built a people-first model for open data based on the belief that open data is only useful if the public knows how to use it. starting with a multistakeholder-drafting of the policy, the city’s open data initiative is committed to community engagement.",https://participedia.net/case/6211
6213,"youth participatory budget, bloomington, in","designed to increase youth engagement in the community and with government, the ypb ran for the first time in 2019. the process is student-led, from writing the rules and developing a timeline, to brainstorming ideas, developing proposals, and voting on final projects.",https://participedia.net/case/6213
6214,beautiful canvas canvas - monghidoro (bologna) [italian],"the name of the process derives from two traditional practices: the ""canto del maggio"" with which people return to visit the villages after the winter and ""tela bella tela"", a traditional local game, with which children learn to remain united despite the difficulties.",https://participedia.net/case/6214
6216,mobilize - union of romagna faentina [italian],path for the participatory definition of interventions in the field of sustainable mobility for home-work paths for craft and industrial areas in the romagna faentina area.,https://participedia.net/case/6216
6222,debate in ponte - tuscany [italian],"a public debate on a new bridge over the arno, already planned, which had been called, with the relative assignment of the task to the manager, who never started and of which no news is given.",https://participedia.net/case/6222
6223,the alberta narratives project,a community-based initiative to seek a more open and constructive basis for conversation about climate and energy among albertans. 75 organizations hosted 55 narrative workshops around the province making this one of the largest public engagements of its kind.,https://participedia.net/case/6223
6224,citizens' jury on the use of ai in decision-making,a citizens' jury deliberated on the ethical issues raised by the application of ai under different circumstances and how public and private entities should respond. the resulting toolkit provides a guide for deploying ethical processes around the proliferation of ai technologies.,https://participedia.net/case/6224
6225,"citizen budget engagement 2020, city of wetaskiwin ",the city's online tool and in-person open houses allow community members to give feedback on annual spending priorities. ,https://participedia.net/case/6225
6226,"tempelhol-schöneberg citizen councils, berlin","the tempelhof-schöneberg district has instated a total of seven citizens' councils based on the vorarlberg model with state funding of 150,000 euros. the first council, assembled by lot, met on 9 and 10 august 2019 and presented its results four days later at a ""bürgercafe"".",https://participedia.net/case/6226
6228,gorgona inclusive and sustainable island,"the gorgona isola inclusiva e sostenibile project concerns the territorial context of the gorgona island (livorno). the prison on the island has characterized its recent history, closing it to the outside world and preserving it. now we look to the future.",https://participedia.net/case/6228
6233,"participatory budgeting at gdańsk university of technology, poland","since 2016, gdańsk university of technology has invited its employees and students to submit proposals for a share of 500,000 zlotys (approx. $130,000 usd).  gut is the first university to institute pb in poland, and 21 projects have been funded and completed as of 2019.",https://participedia.net/case/6233
6234,"participatory budgeting in richmond, va","in october 2019, richmond city council announced that it would be allocating $15 million of its capital improvement program budget for citizen projects. residents will be allowed to suggest, plan, and vote on community improvement projects for a share of the funds.",https://participedia.net/case/6234
6235,people-powered publishing conference,"the pppc uses a hands-on approach to engage journalists, civic-engagement specialists and community storytellers in learning how to create a more collaborative and equitable news landscape by strengthening the connections between news organizations and the people they cover. ",https://participedia.net/case/6235
6236,"the ""ligue os pontos"" program: sustainable, circular and resilient urban agriculture in são paulo",a city-led program to promote a sustainable model of local development by fostering the development of a circular economy between the agricultural production of rural peripheries and the vibrant consumption market of são paulo’s city centre.,https://participedia.net/case/6236
6237,"'development without displacement': the women’s community revitalization project, philadelphia ","a participatory approach to build affordable housing. the wcrp works with residents and neighborhood groups to determine their needs. the group sets up “listening projects” to identify the priorities, community concerns and capacity for similar developments in the neighborhood.",https://participedia.net/case/6237
6238,"pedal to porch, detroit","a neighborhood bike ride with predetermined stops where residents share stories from their front porch. storytelling lowers the barrier of connection between neighbors, strengthens the social fabric of communities, challenges limited narratives of place, and preserve history.",https://participedia.net/case/6238
6239,chilecracia: building a 'just-in-time' participatory platform for protestors in chile,"as chileans filled the streets in the largest protest rally in the country’s history, citizens at the grassroots built a digital platform to give participants a way to communicate and vote on policy ideas. in just 24 hours, over 1 million people voted on more than 60,000 ideas.",https://participedia.net/case/6239
6240,participatory grantmaking in barking and dagenham,"an innovative process using a deliberative mini-public to ensure the allocation of borough funds benefited the whole community. participants selected through sortition met several times to deliberate, evaluate, and select winning grant proposals. ",https://participedia.net/case/6240
6242,camerino reconstruction workshop,a participatory design workshop was used for the drafting of strategic guidelines for the development of the camerino reconstruction plan after the 2016 earthquake.,https://participedia.net/case/6242
6245,participatory budget pilot in lisburn & castlereagh,"the 'grand choice' initiative makes £15,000 available for projects across the district electoral of lisburn & castlereagh. individual citizens and community groups can propose projects under three themes. winning projects will be voted upon by the community.",https://participedia.net/case/6245
6247,#horizon fano 2030 [italian],"the strategic plan does the city. the most advanced experiences show how the outcome of a strategic plan is mainly attributable to the quality of relations between the players in the field, together with the ability to guide and coordinate the process. how did it go to fano?",https://participedia.net/case/6247
6250,stop didymo,"alto al didymo is an app for cell phones that allows citizens to identify, report and prevent the presence of algae ""didymo"" in areas of chilean freshwater. ",https://participedia.net/case/6250
6252,"manich msamah (manich msema7), tunisia",manich msema7 is a tunisian youth-led social movement that resisted anti-reconciliation bills forwarded by the ennahda-nidaa tounes-led government to grant amnesty to former regime officials and bureaucrats accused of corruption under the former ben ali government.,https://participedia.net/case/6252
6254,feminindex in argentina ,feminindex is a questionnaire that measures the political commitment and positioning of candidates regarding the gender agenda in argentina ,https://participedia.net/case/6254
6255,participatory path to composting plants in rome [italian],"the management company of environmental services in rome, ama, must identify sites available for the location of 2 composting plants (from 60,000 t / a) to tackle the waste problem, which is increasingly serious in the capital, but the distrust of citizens is strong.",https://participedia.net/case/6255
6257,sump city of l'aquila - urban sustainable mobility plan [italian],"the sustainable urban mobility plan (sump) is a strategic planning tool that, over a medium-long time horizon (10 years), develops a system vision of urban mobility. it provides a participatory space.",https://participedia.net/case/6257
6260,puglia regional waste management plan,"a participatory process was activated for updating the regional urban waste management plan (gestione dei rifiuti urbani, (prgru)), aiming to draft a document which was consistent with new regulations.",https://participedia.net/case/6260
6294,"melfi, participatory public conference, biomethane plus [italian]",the project involved the construction of a biomethane and compost production plant for anaerobic digestion of urban organic waste (forsu). the municipality of melfi called a participatory public conference and then decided.,https://participedia.net/case/6294
6299,"napoli, urbact iii 2nd chance","as part of the eu urbact iii program, the municipality of naples has chosen the recovery of the complex of the ss. trinità delle monache, with a view to urban regeneration with reference to the territorial context in which it is inserted (quartieri spagnoli and montesanto). ..",https://participedia.net/case/6299
6300,hoboken's online survey on e-scooters,"the city of hoboken's six-month pilot program with lime electric scooters is ending and they must decide whether to keep the scooters. the program has been very contentious, so they used involved to gather feedback from a wide audience of residents. ",https://participedia.net/case/6300
6301,the agora of messina [italian],'' the agora of messina '' is a project of the international organization the democratic society on democratic participation and public spaces in the city of messina. the project aims to create a civic platform capable of connecting citizens.,https://participedia.net/case/6301
6303,"2018 participatory budgeting in canicattini bagni, syracuse, italy","in its second year, the participatory budgeting project of the municipality of canicattini bagni (province of syracuse) involved citizens participating in the allocation of resources to proposed projects in the areas of sport and public education.",https://participedia.net/case/6303
6305,"nyc street homeless solutions' ""model of practice"" policy co-creation",the street homeless solutions division of nyc department of homeless services embarked on a new policy co-creation process inspired by the vtaiwan engagement framework to create a ‘model of practice’ for each of the three core service areas of home-stat street outreach.,https://participedia.net/case/6305
6306,participatory process for the knowledge and identification of the rural landscapes of sardinia [italian],"in 2014 the regional council of sardinia approved the research project aimed at identifying and analyzing rural landscapes according to current needs, also in relation to operational development programs, municipal planning acts and sector plans.",https://participedia.net/case/6306
6310,destination sardinia 2018-2021 - strategic tourism plan [italian],"participatory strategic plan for the development and tourism promotion of sardinia, territorial meetings and online platform are the main participatory tools of the path ...",https://participedia.net/case/6310
6312,"kudumbashree mission in kerala, india","kudumbashree (meaning “prosperity of the family” in the local malayalam language) is the kerala government's ongoing participatory “poverty eradication and women empowerment” mission, which started in 1998, and works through a three-tiered community network of women.",https://participedia.net/case/6312
6316,panchayat (or panchayati) raj,the panchayat raj is a system of local self-government for rural areas in india for the purposes of preparation and implementation of plans for economic development and social justice in rural areas. ,https://participedia.net/case/6316
6318,the national dialogue on mental health,a 2013 conference brought together mental health experts and members of congress to launch a national conversation on mental health to mobilize the public to help individuals suffering from mental illness and prevent future tragedies resulting from ignoring mental illness. ,https://participedia.net/case/6318
6320,an evaluation of glasgow city participatory budgeting 2018-19,"a short, independent evaluation was carried out by the glasgow centre for population health.  the evaluation precludes any assessment of the projects funded and their impacts at a neighbourhood and local level.  ",https://participedia.net/case/6320
6321,democratic superheroes: argentinian participatory election monitoring app,democratic superheroes (span. superhéroes democráticos) is a free application developed by the ngo electoral transparency (span. transparencia electoral) to promote election monitoring in argentina and to inform citizens on election-related topics.,https://participedia.net/case/6321
6322,1800-crime,1800-crime is a tool that promotes citizen participation in the enforcement of security and rule of law. ,https://participedia.net/case/6322
6323,dicamba task force  ,"in 2017, the winthrop rockefeller institute facilitated a two-day deliberation among members of a statewide task force concerning the use and effects of the herbicide dicamba in the u.s. state of arkansas, and about ways to address those effects.",https://participedia.net/case/6323
6324,public consultation on accommodation for refugees (konstanz),"public consultation processes were carried out with regard to two connecting accommodations for refugees in konstanz. efforts to involve citizens in a participatory manner were low, but articulated opinions were taken into account in the decision-making process.",https://participedia.net/case/6324
6325,expert panel review of environmental assessment processes,"between september 1st, 2016 and march 31st, 2017 the canadian environmental assessment agency conducted an expert panel review of the environmental assessment process with the objective of designing a transparent and participatory consultation process.",https://participedia.net/case/6325
6327,"public consultation for a residential building project (fellbach, germany)","an example of a citizen participation project from the city of fellbach, germany for a residential building project, two meetings comprised this participatory process.",https://participedia.net/case/6327
6328,canadian national housing strategy,,https://participedia.net/case/6328
6330,2016 nutrition north canada consultation,,https://participedia.net/case/6330
6332,the way forward on aquaculture,a case study on the government of newfoundland’s co-development process.,https://participedia.net/case/6332
6335,2016 international assistance review,,https://participedia.net/case/6335
6337,venezuelan national hospital survey,"the national hospital survey reports on the operability of medical equipment in public hospitals in venezuela. since the health ministry has not published data in 3 years, the hospital survey has become the main source of information about the crisis of the health system.",https://participedia.net/case/6337
6338,committees for aid and freedom,the committees for aid and freedom are an initiative of the frente amplio venezuela libre with the objective of organizing citizens at the bases of the opposition. ,https://participedia.net/case/6338
6339,south korea’s citizen council on national health insurance,a one-day citizen council initiative that used deliberation as a main method to explore what social values are considered important by lay citizens in health resource allocation priority setting.,https://participedia.net/case/6339
6361,final phase of participatory budgeting in vancouver's west end,"west end (in vancouver, bc)  community members get to vote on how to spend $100,000 of public funds to improve their neighbourhood. ",https://participedia.net/case/6361
6365,redser: dominican network for the sustainable development of renewable energies,redser brings together more than 50 community micro hydro-power plants in the country with the purpose of coordinating the exchange of knowledge and resources for sustainable development among communities.,https://participedia.net/case/6365
6366,first evaluation of the vitoria-gasteiz citizen participation observatory,"vitoria-gasteiz's citizen participation model is formally reviewed. the model was developed according to its three complementary dimensions: a global or general dimension, a sectoral or thematic dimension based on issues that affect citizens, and a territorial dimension.",https://participedia.net/case/6366
6368,socio-educational forum in the dominican republic,the socio-educational forum is a network of 14 organizations working in the field of education in the dominican republic. it monitors the perfomance of public spending and promotes dialogue among stakeholders to improve the quality of education in the country.,https://participedia.net/case/6368
6369,better together design jam,"hosted by vancouver design nerds, this design jam was part of the better together event organized by united way of the lower mainland. ",https://participedia.net/case/6369
6412,caimito sustainable association,the caimito sustainable association (span. asociación caimito sustentable) seeks to strengthen the community through collective efforts for the ecologically conscious development of tourism and agriculture in caimito.,https://participedia.net/case/6412
6417,city of sydney - planning for 2050,in 2018 the city of sydney undertook a multi-phase community engagement to generate ideas inform a vision and plan for the city by 2050. this included a citizens' jury who considered content from experts and the wider public before delivering their recommendations for concepts that should be implemented by 2050.,https://participedia.net/case/6417
6418,parramatta youth jury,"in 2003, parra youth matters, a youth organisation in parramatta (sydney) collaborated with academic partners to organize australia's first youth citizens' jury with 15 young people to deliberate on issues of concern to their community.",https://participedia.net/case/6418
6419,city of parramatta citizens' jury,in 2017 parramatta council in nsw convened its first citizens' jury to decide on a design and plan for its new civic building and library.,https://participedia.net/case/6419
6420,quito open government  ," as a member of the open government partnership, the municipal government of the metropolitan district of quito developed a strategy to set up an open government seeking to enact the principles of transparency, collaboration and participation in their administration.",https://participedia.net/case/6420
