id,title,description,url
7316,"citizens’ jury on finnish democracy: current status, problems and solutions (kansalaisnäkökulma suomalaisen demokratian tilaan, ongelmiin ja ratkaisuihin)","the finnish ministry of justice initiated the citizens’ jury on finnish democracy (kansalaisnäkökulma suomalaisen demokratian tilaan, ongelmiin ja ratkaisuihin) while preparing for the government report on democracy policy. participating citizens deliberated over 2 days in 2013.",https://participedia.net/case/7316
7317,french citizen conference on gmos ,"the citizens' conference on gmos (conférence de citoyens sur les organismes génétiquement modifiés) was initiated by the french government and organized by the opecst. across 3 weekends in 1998, 14 citizens deliberated about gmos in agriculture and nutrition. ",https://participedia.net/case/7317
7318,french citizen conference on climate change,"the citizen conference on climate change (conférence citoyenne “changements climatiques et citoyenneté”) was held in paris from december 2001 to february 2002, gathering 16 citizens to debate issues related to climate change.  ",https://participedia.net/case/7318
7319,french citizen conference on sewage sludge,"the citizen conference on sewage sludge (conférence citoyenne sur le devenir des boues domestiques issues des stations d'épuration) was initiated and convened by the french environment ministry as part of a national debate on water. ultimately, 15 citizens deliberated for 2 days.",https://participedia.net/case/7319
7320,"permanent mixed body for regional employment and training policies (rhône-alpes, france)",the permanent mixed body for regional employment and training policies (ctef) was created in 2004 to coordinate employment and training policies. the ctef began including citizens in 2005—most of whom quit in 2007—but was discontinued in around 2016.,https://participedia.net/case/7320
7321,mini-public on transport policy in three regions of southern france ,"the mini-public on transport policy in 3 regions of southern france (rhône-alpes, provence-alpes-côte d’azur, languedoc-roussillon) was held as part of a debate on the regulation of rhône valley road traffic. 16 people deliberated for 3 weekends.",https://participedia.net/case/7321
7322,"citizen conference on nanotechnologies (île de france, france)","the citizen conference on nanotechnologies (conférence citoyenne sur les nanotechnologies) was established by the regional council of île de france. 16 participants, across 4 weekends, deliberated and wrote a final report about nanotechnologies.",https://participedia.net/case/7322
7323,"mini-public on the future of rural areas (rhônes-alpes, france)","the mini-public on the future of rural areas (jury citoyen sur le devenir des zones rurales) was convened by the regional government of rhône-alpes as part of a larger european consultation on the rural world. ultimately, 38 citizens deliberated across 3 weekends.",https://participedia.net/case/7323
7324,"permanent committee for the funding of participatory projects (rhônes-alpes, france)",the permanent committee for the funding of participatory projects (comité technique pour le financement des projets de démocratie participative) was formed in 2006 by the government of rhône-alpes. the committee disbanded in 2009.,https://participedia.net/case/7324
7325,"mini-public on regional transportation policies (rhônes-alpes, france)","the mini-public on regional transportation policies (atelier citoyen transports et mobilités) was convened by the regional government of rhône-alpes. it took place from january to march 2007, and the 42 participants met over three weekends.  ",https://participedia.net/case/7325
7326,"mini-public on household waste (île de france, france)",the mini-public on household waste (conférence citoyenne sur les déchets ménagers) was convened by the regional government of île de france in 2008. 25 participants met 3 times across 3 weekends to deliberate and write a final report.,https://participedia.net/case/7326
7327," citizen conference on regional development indicators (nord-pas-de-calais, france)",the citizen conference on regional development indicators (conférence citoyenne sur les indicateurs de richesse) was convened by the regional government of nord-pas-de-calais. 15 citizens deliberated and wrote a final report across 4 days.,https://participedia.net/case/7327
7328,"citizens jury on transportation policies (poitou-charentes, france)","the citizens jury on transportation policies (le jury citoyen d’évaluation de la politique régionale « transports et mobilités ») was convened by the region of poitou-charentes. for 3 days, 34 citizens evaluated the region’s transport policies with a focus on rural railway transport.",https://participedia.net/case/7328
7329,french mini-public on end of life care ,the french mini-public on end of life care (conférence citoyenne sur la fin de vie) was held in the framework of a national debate on bioethics in 2013. 18 participants were gathered across 1 day to discuss a possible revision of laws regulating end-of-life care.  ,https://participedia.net/case/7329
7330,french mini-public on healthcare and big data ,"the french mini-public on healthcare and big data (atelier citoyen sur le big data en santé) gathered 17 citizens from may 2016 to june 2016. it was held in the framework of a national debate on big data, but not coupled with a legislative process. ",https://participedia.net/case/7330
7331,french mini-public on addictive behavior at school,"as part of the mini-public on addictive behavior at school (atelier citoyen sur la prévention des conduites addictives en milieu scolaire), 15 citizens gathered in march and april 2017 to discuss preventive measures against addiction among school-age youths. ",https://participedia.net/case/7331
7332,french mini-public in the framework of a national debate on bioethics,the french mini-public in the framework of a national debate on bioethics (comité citoyen des etats généraux de la bioéthique) was a public consultation organized by the ccne. the 22 participants met over 4 weekends from february to may 2018.,https://participedia.net/case/7332
7335,berlin’s citizen juries (2001-2003),"from 2001 to 2003, several citizen juries (berliner bürgerjurys) were held in berlin, with the task of selecting community development projects to be funded and implemented by the city. each jury had 15–30 members, and met regularly to vote on proposals by qualified majority. ",https://participedia.net/case/7335
7336,"consensus conference on genetic diagnosis (dresden, germany)","the consensus conference on genetic diagnosis (bürgerkonferenz „streitfall gendiagnostik“) brought together 19 randomly selected participants in 2001 across 2 weekends to discuss preimplantation genetic diagnosis, prenatal testing, preventive testing, and stem cell research.",https://participedia.net/case/7336
7337,"planification cells on intergenerational relationships in an aging society (rheinland-pfalz, germany)","between june and july 2004, eight planification cells on intergenerational relationships in an aging society (bürgergutachten miteinander der generationen in einer älter werdenden gesellschaft) were commissioned by the ministry of work, family and healthcare of rheinland-pfalz. ",https://participedia.net/case/7337
7338,german citizen conference on high-tech medicine ,"the german citizen conference on high-tech medicine (bürgerreport hightech-medizin – welche gesundheit wollen wir?) was part of a nationwide dialogue on high-tech medicine organized in 2011 by the federal ministry of research. it involved 100 citizens, who deliberated for 1 day.",https://participedia.net/case/7338
7339,german citizen conference on the future energy technologies ,"the citizen conference on the future energy technologies (bürgerdialog “energietechnologien für die zukunft”) was organized by germany's federal research ministry as part of a larger dialogue on new energy technologies. in november 2011, 100 citizens met to draft recommendations.",https://participedia.net/case/7339
7340,german citizen conference on climate policy,"the citizen conference on climate policy (bürgerdialog zum klimaschutzplan 2050) was initiated by the german ministry of the environment as part of a series of environmental consultations. across 1 day, 472 citizens created recommendations for reducing greenhouse gas emissions.",https://participedia.net/case/7340
7342,"regional citizen conferences on the future of bavaria (bavaria, germany)","the citizen conferences on the future of bavaria (regionale bürgerkonferenzen “bürgergutachten 2030: bayern, deine zukunft”) involved 8 conferences with 30 citizens in ansbach, bamberg, deggendorf, garmisch-partenkirchen, memmingen, münchen, neumarkt and rhön-grabfeld. ",https://participedia.net/case/7342
7343,irish citizens' assembly on gender equality,"the citizens' assembly on gender equality is ongoing (since january 2020). it includes 99 randomly selected citizens, who were meant to meet over six weekends throughout the year. due to the covid-19 pandemic, several of these meetings have been postponed (as of march 2021).",https://participedia.net/case/7343
7344,"mini-public on citizen participation in the health budget (tuscany, italy)",the mini-public on citizen participation in the health budget (le vie della partecipatione: partecipazione dei cittadini alla spesa sanitaria) was supported by the tuscany region. the town meeting was meant to outline the priorities of the health budget of the tuscany region.,https://participedia.net/case/7344
7345,"a european town meeting on climate change (tuscany, italy)","the european town meeting on climate change was a mini-public supported by tuscany region, cornellà de llobregat and poitiers. the town meeting was held in five tuscany cities and two other cities; in total, 600 young citizens from the 8 cities were selected.",https://participedia.net/case/7345
7346,civilux: citizens’ consultation on constitutional referendum questions in luxembourg,"civilux was an academic-led project by the research chair in parliamentary studies as part of the referendum campaign on the revision of the luxembourg constitution. in total, 27 citizens were invited to offer an advisory opinion on four referendum questions across 1 day.",https://participedia.net/case/7346
7347,constitulux: citizens' consultation in luxembourg,"constitulux was a follow-up of the 2015 citizens’ consultation civilex, to contribute to understanding the expectations of luxembourgish citizens with respect to constitutional reforms. 60 citizens took part in the 2-day deliberation.",https://participedia.net/case/7347
7348,"citizen's assembly on the future of food (north-brabant, netherlands)","the citizen's assembly on the future of food (voedsel1000) was was installed by the province of noord-brabant. it dealt with questions such as climate change, air quality, soil fertility, and healthy food. in total, it engaged 420 citizens across 5 days.",https://participedia.net/case/7348
7349,"citizens’ assembly limburg (limburg, netherlands)","this was the first citizens’ assembly in limburg, organized simultaneously in three locations. 6 discussion themes were identified, among which were environmental topics, healthcare, and culture. on aggregate, 180 citizens deliberated for 2 days (over 6 months).",https://participedia.net/case/7349
7350,consultation of citizens: aveiro,"the consultation of citizens: aveiro (consulta aos cidadãos - aveiro) was organized by the portuguese government. in 2016, 50 citizens were invited to gather for one day and to deliberate on government recent policies and on demands for the future years.",https://participedia.net/case/7350
7351,the constitutional forum in romania,"the constitutional forum (forumul constituțional) was established by the romanian parliament in order to organize debates and consultations regarding the revision of the romanian constitution. from march to may 2013, over 1,200 people participated in over 50 of its local debates.",https://participedia.net/case/7351
7352,"the citizen forum of san fernando de henares (madrid, spain)","started in 2002, the citizen forum of san fernando de henares (observatorio de la ciudad) is a permanent mini-public. one of its main functions is to evaluate citizen proposals from other institutional participatory mechanisms. it may recommend or reject a referendum for madrid.",https://participedia.net/case/7352
7353,"(e-)skånepanelen: online citizen panel and its citizen groups in skåne, sweden","(e-)skånepanelen is a citizen panel and online survey in which 3000 to 5000 citizens in the region are consulted yearly on issues such as healthcare, regional development and the climate. started in 2014, it is part of open skåne 2030: a plan to involve citizens in policymaking.",https://participedia.net/case/7353
7354,uk climate change citizens’ summit (march 2007),"the climate change citizens’ summit involved six regional workshops—in bristol, birmingham, london, newcastle, nottingham and manchester—held during in late march and early april 2007. the workshops involved 28 to 29 people each, for a total of 174 participants. ",https://participedia.net/case/7354
7355,uk climate change citizens’ summit (may 2007),this climate change citizens’ summit was the follow-up event of the six regional workshops held during in late march and early april 2007. all participants in the regional workshops were invited to the reconvened citizens' summit; 152 public participants attended.,https://participedia.net/case/7355
7356,uk deliberative workshop on the 2007 draft legislative forum,"the deliberative workshop on the 2007 draft legislative forum was coordinated by the british cabinet office. it involved 9 regional events with local stakeholders, such as local authorities, local businesses, and district councils.",https://participedia.net/case/7356
7357,mini-public on national pensions debate and national pensions day in the uk,"the 2006 mini-public on national pensions debate and national pensions day was sponsored by the department of works and pensions. its goal was to “rais[e] awareness of the pension challenges facing society"" and understand ""public views on [...] reform to the uk pension system.”",https://participedia.net/case/7357
7358,scottish jury on land use management,"the scottish jury on land use management gathered 22 citizens for 2 and a half days in the scottish parliament. the jury's recommendations were to inform the work of the scottish parliament’s environment, climate change, and land reform committee. ",https://participedia.net/case/7358
7359,talking energy: mini-public on the future of nuclear power in the uk,"the  mini-public on the future of nuclear power was launched by the british government in 2007. it involved 949 participants across nine deliberative events—in edinburgh, newcastle, liverpool, leicester, norwich, cardiff, london, exeter and belfast—on 8 september 2007. ",https://participedia.net/case/7359
7360,uk people’s panel (online),"in 1998, the new labour government commissioned mori to create the “people’s panel”. its aim was to create a large representative population that could measure public opinion on various public issues. the people's panel was dissolved in 2002.",https://participedia.net/case/7360
7361,"mini-public in the uk: your health, your care, your say","in 2005, the uk department of health commissioned a national “listening exercise” about the national health service called “your health, your care, your say."" 4 regional events with 50–100 people took place, after which a 986-person “national citizen’s summit” was held.",https://participedia.net/case/7361
7362,gordon brown’s citizens’ juries in the uk: children & families,"this citizens' jury on children & families was part of uk prime minister gordon brown's proposal for the use of citizens' juries. five were conducted by the department for children, schools and families; this specific jury met in bristol.",https://participedia.net/case/7362
7363,gordon brown’s citizens’ juries in the uk: crime,"this citizens' jury on crime was part of uk prime minister gordon brown's proposal for the use of citizens' juries. five were conducted by the department for children, schools and families; this specific jury met in leicester.",https://participedia.net/case/7363
7364,gordon brown’s citizens’ juries in the uk: national health service,"this citizens' jury on the national health service was part of uk prime minister gordon brown's proposal for the use of citizens' juries. 9 nhs citizens' juries took place in 2007, organized simultaneously and connected via livestream. ",https://participedia.net/case/7364
7366,citizen debate on educational reform in french-speaking belgium,the french community in belgium organized a deliberative panel bringing together 24 citizens over 3 weekends to discuss the reform of compulsory education in french-speaking belgium.,https://participedia.net/case/7366
7367,deliberative panel on secondary education reform in flanders ,the flemish minister of education is organizing a deliberative panel over three weekends to consult 24 citizens drawn by lot on the reform of secondary education then underway in flanders.,https://participedia.net/case/7367
7368,"“quelle europe pour demain ?"": deliberative panel in belgium on the eu",the parliament of the french community of belgium organized a two-day deliberative panel with 89 people to raise awareness and consult citizens on the european union.,https://participedia.net/case/7368
7370,"""we are molenbeek"" deliberative panel","following the 2016 brussels attacks, the municipality of molenbeek saint-jean – where the attackers lived – decided to organize a deliberative panel with 112 citizens. the goal was to set priorities for living together and for fighting the radicalization of its residents.",https://participedia.net/case/7370
7371,city shapers: cityhive's metro vancouver youth civic education program,"city shapers was an experiential, cohort-based civic education program for metro vancouver young adults. over 2019-2020, 3 cohorts explored pressing urban issues, with an emphasis on the municipal level and local decision-making.",https://participedia.net/case/7371
7372,building citizen bonds,"the municipality of verviers launched a deliberative participation process with 16 citizens in order to find solutions to create links (""social cohesion"") between the different districts of the city as well as between elected officials and citizens.",https://participedia.net/case/7372
7373,maine ranked choice voting,"in 2016, maine voted to replace its traditional electoral system with ranked-choice voting (rcv). it did so through a ballot initiative after many legislative efforts to institute rcv had failed. after a legal challenge, a 2018 ""people's veto"" referendum bolstered rcv in maine. ",https://participedia.net/case/7373
7374,ocpm | right of initiative and access routes to mount royal,"the participatory approach analyzed consists of reducing traffic on the access routes to mount royal, located on the camilien-houde route, in montreal.",https://participedia.net/case/7374
7375,the dao hack,the most famous attack on any blockchain project. the dao hack was a re-entrancy attack on one of the earliest decentralised autonomous organisations.,https://participedia.net/case/7375
7377,cese citizen group on social inequality in france,"the cese (economic, social and environmental council) convened a temporary committee to put forward policy recommendations regarding socioeconomic, political and geographic inequalities in france.",https://participedia.net/case/7377
7378,"mini-public on a regional law for citizens’ participation (tuscany, italy)",this mini-public is supported by tuscany region. the town meeting was aimed at listing the priorities for the regional law on participation and at transforming these priorities in actual policy proposals.,https://participedia.net/case/7378
7380,citizens' committee on vaccination against covid-19,"in order to support the covid-19 vaccination strategy in france, a citizens' committee has been created by the cese. this group is made up of 35 randomly selected citizens and aims to provide advice and recommendations during the vaccination campaign.",https://participedia.net/case/7380
7381,scottish parliament citizens’ panel on covid-19,the covid-19 committee of the scottish parliament convened a citizens’ panel to inform its oversight on the measures put in place by the government. the panel was comprised of 19 citizens randomly selected and organized virtually over four meetings in january and february 2021. ,https://participedia.net/case/7381
7382,"neighborhood group support initiative in aurora, il","the city of aurora in illinois has created an ongoing program to help establish and support neighborhood groups, which hold meetings and host community events, in an effort to improve community-police relations and decrease violent crime.",https://participedia.net/case/7382
7384,"argentina’s campaign for the right to legal, safe and free abortion ","since 2005, women’s movements in argentina have been working to articulate and promote the national campaign for the right to legal, safe and free abortion, culminating in the legalization of abortion in december 2020.",https://participedia.net/case/7384
7386,hisd stucon: covid-19 school reopening survey ,the houston independent school district student congress “hisd stucon” launched a survey to gain student input about school reopening during the covid-19 pandemic. ,https://participedia.net/case/7386
7388,"participatory budgeting in lausanne, switzerland ","this pilot project is the first city-wide participatory budgeting (pb) in switzerland, starting in 2019, and financed by the swiss confederation for three years. ",https://participedia.net/case/7388
7389,"¡en mi barrio, yo decido! - online participatory budgeting in peñalolén","the government of peñalolén, a municipality in the santiago province of chile, developed an online-only participatory budgeting scheme to better engage the citizens with government decisions and to understand their opinions/preferences on budget choices. 24450 citizens took part.",https://participedia.net/case/7389
7391,deliberative polling® on policies toward the roma in bulgaria,"bulgaria's second deliberative poll was held due to the generational poverty faced by its roma population. the results show that policy stances changed amongst most participants in relation to housing, education and higher levels of roma representation in public offices.",https://participedia.net/case/7391
7392,"co-management programme of fisheries in lake malombe, malawi","the co-management programme was introduced in lake malombe in attempt to resurrect the failing fishery. representatives from the local area were elected to form the institution known as the beach village committee, or commonly referred to as the bvc. ",https://participedia.net/case/7392
7393,"participatory budgeting in matam, senegal",participatory budgeting in senegal was implemented due to political change which was constrained by budget limits. an ngo called ecopop was contacted to aid in resource mobilisation and improve transparency.,https://participedia.net/case/7393
7394,parks masterplanning in leighton linslade using planning for real®,leighton linslade town council appointed planning for real in order to consult citizens of the town on what features should be considered in their park's 20 year plan. ,https://participedia.net/case/7394
7395,participatory budgeting (pb): city of durham cycle 1,"in 2018, the durham city council approved $2.4m in funding and appointed a committee to create goals and aid the programmes' administration. each of the 3 wards received $800,000, allowing residents to decide how to allocate this budget for projects within their community.",https://participedia.net/case/7395
7396,community driven development: community investment in rural areas project in bolivia,"bo picar community investment in rural areas was a project aiming to fight rural poverty by providing access to basic infrastructure and services in rural bolivia. through this initiative, over 350,000 people were able to gain access to basic infrastructures and services.",https://participedia.net/case/7396
7397,"participatory budgeting in maputo, mozambique, 2008","the municipality of maputo, with funding from the world bank, sought to involve the citizens in the allocation of funds to community infrastructure projects.",https://participedia.net/case/7397
7400,"participatory budgeting in the indische buurt, amsterdam","in the fall of 2012, the eastern district of amsterdam, the indische buurt neighbourhood, joined the national participatory budgeting scheme, thereby aiding the original aim by allowing for better national budget monitoring. ",https://participedia.net/case/7400
7403,maple wind turbines,"implementation of a wind farm in the mrc de l'érable in quebec. the project caused great tension, leading to a deterioration of the social climate. legal proceedings initiated by the affected municipalities against the project promoter.",https://participedia.net/case/7403
7406,citizen channel,,https://participedia.net/case/7406
7407,"citizen panel on early childhood (eupen, belgium)",,https://participedia.net/case/7407
7408,"citizen panel for the esplanade (ottignies-louvain-la-neuve, belgium)",,https://participedia.net/case/7408
7409,"citizen panel on aging issues (namur, belgium)",,https://participedia.net/case/7409
7410,my dna: all concerned (belgium),,https://participedia.net/case/7410
